{
  "id": "baseline-review",
  "mode": "review",
  "baseCommit": "36a2b4db7a8ed2633bb503bd2720ff42aa0220a8",
  "objective": "Review .ai-ops/BASELINE.md against the repository and report only missing classifications, contradictory classifications, or safety gaps. Do not modify files and do not redesign the product.",
  "allowedPaths": [],
  "forbiddenPaths": ["**"],
  "verification": ["git status --short", "git diff --stat"],
  "maxTurns": 6,
  "timeoutMs": 600000
}
