{
  "id": "connection-smoke",
  "mode": "review",
  "baseCommit": "36a2b4db7a8ed2633bb503bd2720ff42aa0220a8",
  "objective": "Report the current branch, HEAD, git status, and summarize the P1 and D6 frozen rules. Do not suggest or make implementation changes.",
  "allowedPaths": [],
  "forbiddenPaths": ["**"],
  "verification": ["git branch --show-current", "git rev-parse HEAD", "git status --short"],
  "maxTurns": 4,
  "timeoutMs": 300000
}
